{
  "raw_request": "docs/reqs/agentic-edd-refinement/deliverables/01-target-repository-preflight/story.md",
  "title": "Resolve and Validate the Target Repository",
  "story": {
    "so_that": "automated refinement never mutates the wrong repository or overwrites unrelated work",
    "as_a": "workflow requester",
    "i_want": "the workflow to resolve exactly one target Git worktree and validate all safety preconditions before refinement begins"
  },
  "target_persona": {
    "name": "Workflow Requester - Automation Orchestrator",
    "role": "Workflow Requester",
    "technical_level": "Expert",
    "journey": {
      "before": "Prepares a refinement request with a repository anchor or explicit target root, scoped inputs, required test cases, evaluation configuration, and execution limits",
      "during": "Submits the request and expects the workflow to discover one canonical Git worktree, validate all safety preconditions, and acquire a repository-scoped mutation lease",
      "after": "Receives either a validated, clean, leased target repository with a recorded starting revision, or a complete report of every failed precondition with no side effects"
    }
  },
  "capability_breakdown": {
    "core_action": "Resolve and validate exactly one target Git worktree and all preflight safety conditions before refinement begins",
    "inputs": [
      "Repository anchor path or explicit target repository root",
      "Scoped inputs, skills, evaluations, and authorized-scope paths",
      "Required test cases",
      "Deterministic evaluation command configuration",
      "Single execution provider",
      "Iteration and token limits",
      "Repository-scoped mutation lease policy"
    ],
    "outputs": [
      "Canonical target worktree path",
      "Recorded starting revision",
      "Repository-scoped mutation lease",
      "Preflight success or failure report"
    ],
    "state_changes": [
      "Acquire a repository-scoped mutation lease when preflight succeeds",
      "Record the canonical worktree path and starting revision"
    ],
    "affected_components": {}
  },
  "acceptance_criteria": [
    {
      "criterion": "Given a repository anchor path and no explicit target repository root, when preflight runs, then the workflow resolves the nearest containing Git worktree root and records its canonical path and starting revision",
      "gherkin": "Given a repository anchor path and no explicit target repository root when preflight runs then the workflow resolves the nearest containing Git worktree root and records its canonical path and starting revision",
      "type": "Functional",
      "jtbd": "Resolve the correct target repository",
      "persona_served": "Workflow Requester - Automation Orchestrator"
    },
    {
      "criterion": "Given both an anchor-derived root and an explicit root are supplied and they identify different Git worktrees, when preflight runs, then the request is rejected before any agent is invoked",
      "gherkin": "Given an anchor-derived root and an explicit root that identify different Git worktrees when preflight runs then the workflow rejects the request before invoking an agent",
      "type": "Business rule",
      "jtbd": "Reject conflicting repository roots",
      "persona_served": "Workflow Requester - Automation Orchestrator"
    },
    {
      "criterion": "Given a scoped input, skill, evaluation, or authorized-scope path resolves outside the target worktree, when preflight validates it, then the request is rejected",
      "gherkin": "Given a scoped input, skill, evaluation, or authorized-scope path resolves outside the target worktree when preflight validates it then the workflow rejects the request",
      "type": "Constraint",
      "jtbd": "Keep scoped inputs inside the target worktree",
      "persona_served": "Workflow Requester - Automation Orchestrator"
    },
    {
      "criterion": "Given the target worktree has staged, unstaged, or untracked changes, when preflight inspects repository status, then the workflow rejects the request and leaves the worktree unchanged",
      "gherkin": "Given the target worktree has staged, unstaged, or untracked changes when preflight inspects repository status then the workflow rejects the request and leaves the worktree unchanged",
      "type": "Error handling",
      "jtbd": "Prevent mutation of dirty worktrees",
      "persona_served": "Workflow Requester - Automation Orchestrator"
    },
    {
      "criterion": "Given another workflow run already holds the mutation lease for the same target repository, when preflight runs, then the workflow rejects or waits according to configured policy without starting refinement",
      "gherkin": "Given another workflow run already holds the mutation lease for the same target repository when preflight runs then the workflow rejects or waits according to configured policy without starting refinement",
      "type": "Business rule",
      "jtbd": "Avoid concurrent refinement",
      "persona_served": "Workflow Requester - Automation Orchestrator"
    },
    {
      "criterion": "Given the target skill does not exist, or exists but has no evaluation suite, in the target repository, when preflight runs, then the workflow rejects the request before refinement begins",
      "gherkin": "Given the target skill does not exist or exists without an evaluation suite in the target repository when preflight runs then the workflow rejects the request before refinement begins",
      "type": "Error handling",
      "jtbd": "Require a valid skill and evaluation suite",
      "persona_served": "Workflow Requester - Automation Orchestrator"
    },
    {
      "criterion": "Given required test cases, a deterministic evaluation command, a single execution provider, and iteration or token limits are all supplied and valid, when preflight runs, then preflight succeeds, acquires the repository mutation lease, and reports no other side effects",
      "gherkin": "Given required test cases, a deterministic evaluation command, a single execution provider, and valid iteration and token limits when preflight runs then preflight succeeds, acquires the repository mutation lease, and reports no other side effects",
      "type": "Functional",
      "jtbd": "Pass preflight validation",
      "persona_served": "Workflow Requester - Automation Orchestrator"
    },
    {
      "criterion": "Given any precondition fails, when preflight completes, then the workflow reports every failed condition and releases any lease it had acquired",
      "gherkin": "Given any precondition fails when preflight completes then the workflow reports every failed condition and releases any lease it had acquired",
      "type": "Error handling",
      "jtbd": "Report every failed precondition",
      "persona_served": "Workflow Requester - Automation Orchestrator"
    }
  ]
}
