{
  "raw_request": "docs/ex/be-only/search_optimization.md",
  "title": "Improve Search Performance",
  "story": {
    "so_that": "I can search for active tactics efficiently",
    "as_a": "User",
    "i_want": "receive first page search results within 3 seconds"
  },
  "target_persona": {
    "name": "Internal Requester",
    "role": "User",
    "technical_level": "Intermediate",
    "journey": {
      "before": "User needs to search through active tactics but experiences slow search response times that impact productivity",
      "during": "User submits search query with filters and waits for results to be returned from the database",
      "after": "User receives search results within 3 seconds and can view, filter, or refine their search with new tactics immediately visible"
    }
  },
  "capability_breakdown": {
    "core_action": "Optimize search performance to return first page results within 3 seconds while maintaining existing filter functionality",
    "inputs": [
      "Search query",
      "Existing search filters",
      "Tactic data in database"
    ],
    "outputs": [
      "First page of search results",
      "Filtered tactic list",
      "Performance metrics"
    ],
    "state_changes": [
      "Search results are updated when new tactics are created",
      "Database query performance is improved"
    ],
    "affected_components": {
      "ui": "Search results display component",
      "api": "Search endpoint API",
      "database": "Tactic data queries and indexes",
      "external_services": "None"
    }
  },
  "acceptance_criteria": [
    {
      "criterion": "Existing Filters continue to work",
      "gherkin": "Given I am an Internal Requester When I use any existing search filters Then the filters continue to work as before And the search results are returned within 3 seconds",
      "type": "Functional",
      "jtbd": "Apply search filters without performance degradation",
      "persona_served": "Internal Requester"
    },
    {
      "criterion": "Results Update on new Search",
      "gherkin": "Given I am an Internal Requester and I previously completed a search and a NEW Tactic was just created When I search again Then the new tactic should be included in the search results AND the search results should be returned within 3 seconds",
      "type": "Functional",
      "jtbd": "See newly created tactics in search results",
      "persona_served": "Internal Requester"
    },
    {
      "criterion": "Search performance meets SLA",
      "gherkin": "Given a user submits a search query When the search completes Then results are returned within 3 seconds",
      "type": "Non-functional",
      "jtbd": "Receive search results quickly",
      "persona_served": "Internal Requester"
    },
    {
      "criterion": "Existing APIs remain unchanged",
      "gherkin": "Given existing API consumers When they call search endpoints Then the API contracts remain unchanged",
      "type": "Functional",
      "jtbd": "Maintain backward compatibility",
      "persona_served": "Internal Requester"
    }
  ]
}
